{
  "version": 1,
  "fetchedAt": "2026-01-03T00:00:00.000Z",
  "endpoint": "/svc/apis/sto/stk_bydd_trd",
  "params": [["basDd", "20260102"]],
  "data": [
    {
      "BAS_DD": "20260102",
      "ISU_CD": "KR7005930003",
      "ISU_NM": "삼성전자",
      "MKT_NM": "KOSPI",
      "SECT_TP_NM": "보통주",
      "TDD_CLSPRC": "70000",
      "CMPPREVDD_PRC": "1000",
      "FLUC_RT": "1.45",
      "TDD_OPNPRC": "69000",
      "TDD_HGPRC": "70500",
      "TDD_LWPRC": "68800",
      "ACC_TRDVOL": "1000000",
      "ACC_TRDVAL": "70000000000",
      "MKTCAP": "417000000000000",
      "LIST_SHRS": "5969782550"
    }
  ]
}
